{
  "schema_version": "submission-packet-inventory/1.0",
  "inventory_id": "fixture.coverage-advisory",
  "declared_by": "author",
  "packet_responsibility_role_ids": [
    "investigator",
    "investigator_and_irb"
  ],
  "authorization_status_input": {
    "value": "not_provided",
    "source_reference": null,
    "provenance": "caller_supplied_no_derivation"
  },
  "waiver_or_exception_claims": [],
  "artifacts": [
    {
      "artifact_id": "fixture.us-consent",
      "relative_path": "consent.txt",
      "declared_sha256": "d1fb480857f76596fc293957798cc5e8acf15e5853b45b317b5790999d60035f",
      "declared_size_bytes": 80,
      "media_type": "text/plain",
      "artifact_type": "consent_materials",
      "declared_holder_role_id": "investigator",
      "evidence_bindings": [
        {
          "requirement_id": "us.45cfr46.116.informed-consent",
          "evidence_id": "consent.participant-materials"
        }
      ],
      "declared_structure": {
        "version_id": "v1",
        "document_date": "2026-08-09",
        "signature_blocks": [],
        "certificate": null
      }
    }
  ]
}
